duplicate,#,question,choices,answer,explanation,source
,35,Universal Containers (UC) provides customer support for two separate business groups. UC requires that cases for each business group have different support processes and fields.Which feature should a consultant implement to meet the requirement?,A. Omni-Channel | B. Record Types | C. Dynamic Forms,B,"Record Types in Salesforce allow different page layouts, picklist values, and support processes to be configured for different case categories. This enables each business group to have unique fields and stages for their cases.",https://www.freecram.com/Salesforce-certification/Service-Cloud-Consultant-exam-questions.html?p=7
,36,"To help service reps more accurately respond to a new case, Universal Containers wants a list of relevant Knowledge articles displayed on the Case record page.How should a Service Cloud Consultant configure this requirement?",A. Add the Knowledge related list to the Case record page. | B. Add the Knowledge component to the Case Lightning record page. | C. Add the Knowledge component to the Case page layout.,B,"The Knowledge component on a Case Lightning record page displays relevant articles based on case data and allows agents to view and attach articles directly from the case record, enabling quick access without leaving the page.",https://www.freecram.com/Salesforce-certification/Service-Cloud-Consultant-exam-questions.html?p=8
,37,Cloud Kicks (CK) provides product support based on Service Contracts. A customer's Service Contract includes the same Service Level Agreement (SLA) for both Cases and Work Orders. CK would like an efficient method to manage the setup.What is the recommended configuration to meet the requirements?,A. Create a single entitlement process on both the Case and the Work Order. | B. Create a Flow to assign the entitlement process to the Work Order. | C. Create separate entitlement processes for the Case and Work Order.,A,"Creating a single entitlement process applicable to both Case and Work Order objects is the most efficient approach. Salesforce allows entitlement processes to be associated with multiple objects, eliminating duplicate setup.",https://www.freecram.com/Salesforce-certification/Service-Cloud-Consultant-exam-questions.html?p=8
,38,Universal Containers' customers prefer speaking to a live support agent for complex product issues. This results in a high volume of phone calls and customer dissatisfaction about long hold times.Which functionality should the consultant recommend to address the problem?,A. Embedded Chat window | B. Contact requests | C. Web-to-Case,A,"An embedded chat window provides real-time live support as an alternative to phone calls, reducing hold times. Contact requests (callback) would also help, but embedded chat directly addresses 'complex product issues' needing live interaction.",https://www.freecram.com/Salesforce-certification/Service-Cloud-Consultant-exam-questions.html?p=8
,39,Universal Containers (UC) is using skills-based routing to assign cases to service reps based on their relevant product specialization. UC also wants to automatically assign service reps to the next case to evenly distribute the case workload.,A. Least Active | B. Manual Push | C. Most Available,C,"'Most Available' routing model in Omni-Channel automatically assigns work to the agent with the most available capacity, ensuring even distribution of cases across the team based on current workload.",https://www.freecram.com/Salesforce-certification/Service-Cloud-Consultant-exam-questions.html?p=8
,40,"Universal Containers wants to automate responses to a high volume of common customer queries such as""What's my account number?"" or ""I need to reset my password."" They require a solution that can operate 24/7, provide natural, conversational replies, and understand the context of the entire conversation.What should the Service Cloud Consultant recommend?","A. Implement Agentforce Service Agent with standard topics like ""Account Management"" and associated actions. | B. Implement generative Search Answers on a customer-facing knowledge base. | C. Implement public knowledge base in an Experience Cloud and create users for each customer.",A,"Agentforce Service Agent with standard topics like 'Account Management' provides out-of-the-box 24/7 conversational AI that can handle natural language queries, understand conversation context, and perform actions on behalf of customers.",https://www.freecram.com/Salesforce-certification/Service-Cloud-Consultant-exam-questions.html?p=8
,41,"Cloud Kicks wants to offer its customers a more personalized, flexible service experience beyond emails, phone calls, and chatbots.What should the consultant recommend to meet this requirement?",A. Social media | B. Messaging apps | C. Salesforce Knowledge,B,"Messaging apps (WhatsApp, SMS, Facebook Messenger) provide personalized, flexible, asynchronous support that goes beyond traditional email, phone, and chatbots. They meet customers on platforms they already use daily.",https://www.freecram.com/Salesforce-certification/Service-Cloud-Consultant-exam-questions.html?p=9
,42,"A global automotive company wants to enhance its service experience by integrating multiple sources of vehicle and customer data-including sensor data, service history, and financing details-into Salesforce. The goal is to gain a holistic view of customer interactions and vehicle health, trigger alerts based on real-time data, and route cases to the appropriate service channels.","A. Use custom objects and external services to store incoming data, and configure Flow to manage alerts and routing logic. | B. Use Data Cloud to unify real-time data from multiple sources and power alerts, calculated insights, and case routing in Service Cloud. | C. Use MuleSoft to sync data from external systems into standard Salesforce objects by using scheduled batch jobs.",B,"Data Cloud is the recommended solution for unifying real-time data from multiple external sources (sensor data, service history, financing) with CRM data. It enables calculated insights, real-time alerts, and intelligent case routing in Service Cloud.",https://www.freecram.com/Salesforce-certification/Service-Cloud-Consultant-exam-questions.html?p=9
,43,What should a consultant recommend to ensure chat requests contain sufficient information for service agents to respond effectively?,A. Customize Intents using Einstein Chatbots. | B. Customize the Lightning Console chat page. | C. Customize the pre-chat form.,C,"Customizing the pre-chat form allows organizations to collect key information from customers before a chat session starts (such as name, account number, and issue description), giving agents the context needed to respond effectively.",https://www.freecram.com/Salesforce-certification/Service-Cloud-Consultant-exam-questions.html?p=9
,44,"Universal Containers wants to automate the process of case creation. While conducting a business process review, the consultant learned that customers sometimes upload digital pictures of the problem.Following best practices, which solution should a consultant recommend?",A. Email-to-Case | B. AppExchange package | C. Web-to-Case,A,"Email-to-Case is the best practice solution for automated case creation from customer emails, including support for file attachments. It handles digital pictures sent by customers and maps email content to case fields automatically.",https://www.freecram.com/Salesforce-certification/Service-Cloud-Consultant-exam-questions.html?p=9
,45,Cloud Kicks is implementing a focused Messaging strategy to pass priority issues to the right reps.Which solution should a Service Cloud Consultant explore to track handle time and messaging session resolution on these specific interactions?,A. Create a custom report type with AgentWork as the primary object and Messaging Session as the secondary object. | B. Create a custom report type with AgentWork as the primary object and Messaging User as the secondary object. | C. Create a custom report type with Messaging Session as the primary object and AgentWork as the secondary object.,C,Creating a custom report type with Messaging Session as the primary object and AgentWork as the secondary object provides the correct relationship to report on handle time and resolution metrics for specific messaging interactions.,https://www.freecram.com/Salesforce-certification/Service-Cloud-Consultant-exam-questions.html?p=9
,46,Universal Containers (UC) has hired a consulting firm to implement Service Cloud for its contact center for the first time. The project requires quick iterations and speedy completion. UC has requested frequent updates from the project team for check-ins and refinement.Which methodology should the consultant recommend given the requirements?,A. Waterfall | B. Hybrid | C. Agile,C,"Agile methodology is recommended for projects requiring quick iterations, frequent check-ins, and regular refinement. It supports the client's need for rapid delivery and continuous updates through sprints and regular stakeholder collaboration.",https://www.freecram.com/Salesforce-certification/Service-Cloud-Consultant-exam-questions.html?p=10
,47,Universal Containers aims to improve the efficiency of its internal service reps by improving case resolution times. The service reps need to follow a series of steps to resolve an issue and generate concise case summaries.Which solution should the Service Cloud Consultant recommend?,A. Agentforce Service Assistant | B. Actions & Recommendations | C. Einstein Article Recommendations,A,"Agentforce Service Assistant (formerly Einstein for Service) provides AI-guided step-by-step guidance for agents resolving issues and can automatically generate concise case summaries, improving efficiency and reducing resolution time.",https://www.freecram.com/Salesforce-certification/Service-Cloud-Consultant-exam-questions.html?p=10
,48,Universal Containers (UC) has created a new partner onboarding process that requires an agent to create 10 open activities that correlate to a step of the onboarding experience. UC typically adds 20 new partners a week. Creating activities is labor intensive and can take up to 20 minutes each to complete.What is a cost-effective method for agents to create these activities?,A. Execute a macro | B. Navigate a Screen Flow. | C. Leverage Einstein Case Wrap-Up.,A,"Macros in Salesforce automate repetitive tasks with a single click. Running a macro can automatically create all 10 activities with predefined values, dramatically reducing the 20-minute manual effort per onboarding partner.",https://www.freecram.com/Salesforce-certification/Service-Cloud-Consultant-exam-questions.html?p=10
,49,Cloud Kicks (CK) uses Lightning Dialer and one-click calling to initiate phone calls to customers. CK has recently received complaints from customers who have set their communication preferences to email only or text only.What is the most efficient solution the consultant should use to meet the requirements?,A. Remove the phone number from the page layout. | B. Use Dynamic Forms to hide the phone number. | C. Set the Contact Do Not Call field value to True.,C,"Setting the Contact's 'Do Not Call' field to True respects customer communication preferences and prevents the phone number from being used for calls through Lightning Dialer, the most efficient and standards-compliant approach.",https://www.freecram.com/Salesforce-certification/Service-Cloud-Consultant-exam-questions.html?p=10
,50,"Support supervisors at Cloud Kicks want to view key performance indicators (KPIs) and see graphs and data about their Service Cloud Voice contact centers.How can they track call volume, average handle time, average speed to answer, and more metrics?",A. Use the Service CRM Analytics app. | B. Create a custom dashboard with reports on cases and service rep work. | C. Install a Service Cloud Reports package from the AppExchange.,A,"The Service CRM Analytics app (formerly Einstein Analytics for Service) provides prebuilt dashboards with KPIs for Service Cloud Voice including call volume, average handle time, and average speed to answer metrics.",https://www.freecram.com/Salesforce-certification/Service-Cloud-Consultant-exam-questions.html?p=10
,51,Universal Containers needs to provide contact center agents with access to a customer's payment history if the call concerns a billing problem. The following considerations need to be taken into account:* Billing data is stored in an external system containing over 20 million records.* Only the finance department has direct access to the billing system.Which solution should a consultant recommend?,A. Create a custom tab that displays a search page from the billing system. | B. Integrate payment data into Salesforce from the billing system using custom objects. | C. Configure Salesforce Connect and External Objects to the billing system.,C,Salesforce Connect with External Objects allows real-time access to data stored in external systems without importing it into Salesforce. It's ideal for large external datasets (20M+ records) where sync is impractical and only finance has direct access.,https://www.freecram.com/Salesforce-certification/Service-Cloud-Consultant-exam-questions.html?p=11
,52,"Cloud Kicks provides support to customers across the world and uses Lightning Experience. Service agents have a set of common responses.Managers would like to consolidate the responses as quick text, translate them to multiple languages, and share them with the correct groups of service agents.What should a consultant recommend to meet the requirements?",A. Use custom labels to manage quick text translations. | B. Share a folder with quick text for each translation. | C. Share each quick text individually to Public Groups.,B,"Sharing a folder with quick text translations per language is the recommended approach. Folders can be shared with specific groups of agents, allowing managers to organize and distribute translated quick text efficiently.",https://www.freecram.com/Salesforce-certification/Service-Cloud-Consultant-exam-questions.html?p=11
,53,Cloud Kicks is thinking about implementing Swarming in Slack to allow multiple experts to collaborate on cases.What is a consideration of this approach?,"A. Swarm channels default to public channels in Slack. | B. When users are added to the channel, they cannot see historical posts. | C. Swarms can only be created in new channels created for the issue.",B,"When users are added to an existing Slack swarm channel, they cannot see the historical posts made before they joined. This is a key consideration when planning Swarming workflows to ensure all experts have full context.",https://www.freecram.com/Salesforce-certification/Service-Cloud-Consultant-exam-questions.html?p=11
,54,Cloud Kicks (CK) uses Lightning Experience and Lightning Knowledge in its service center. CK wants an easy way for service agents to create new articles when closing a case. The new article should include appropriate details from the case to make it useful for others.,A. Use a trigger to automatically create a new article. | B. Develop a globally-shared macro to create a new article. | C. Create a Quick Action to map case fields to a new article.,C,"A Quick Action on the Case object can be configured to create a new Knowledge article pre-populated with mapped case fields (subject, description, etc.), making it easy for agents to capture case knowledge during closure.",https://www.freecram.com/Salesforce-certification/Service-Cloud-Consultant-exam-questions.html?p=11
,55,A Service Cloud Consultant is working with a telecommunications client. The client aims to improve first- contact resolution by 30% through implementing new case automation and Agentforce Service Agent. The client expects the changes to enhance customer satisfaction but is concerned about adoption and system complexity.What should the consultant do first to help manage concerns and align expectations?,"A. Develop a detailed Agentforce Service Agent configuration plan with automated case routing rules and escalation paths, then validate technical requirements with the IT team. | B. Conduct a risk register focusing on technical challenges, user adoption barriers, and impact on existing workflows while engaging key stakeholders early. | C. Recommend postponing the project until all technical requirements are finalized, then create a comprehensive change management strategy for user adoption.",B,"A risk register with early stakeholder engagement helps identify adoption barriers, technical challenges, and workflow impacts proactively. Conducting this first ensures concerns are surfaced and managed before implementation begins.",https://www.freecram.com/Salesforce-certification/Service-Cloud-Consultant-exam-questions.html?p=11
,56,"Cloud Kicks uses a console app to support users. Service agents open an Account workspace tab and multiple subtabs for the Case, Contact, and Service Contract. Service agents would like to share links to recently opened subtabs with other users to collaborate on cases.What should a consultant recommend to meet the requirements?",A. Add the Account object to Recent Items utility. | B. Include the History utility in the console app. | C. Mention the case number in a Chatter group.,C,"The History utility in Service Console tracks recently viewed tabs and subtabs, allowing agents to share deep links to specific records (like subtabs) with colleagues for collaboration on cases.",https://www.freecram.com/Salesforce-certification/Service-Cloud-Consultant-exam-questions.html?p=12
,57,"Cloud Kicks has several hundred knowledge articles that span dozens of topics and cover a wide range of products, help articles, and trouble shooting ideas. The admin at Cloud Kicks is going to organize the knowledge articles into Data Categories.What should the admin keep in mind when organizing articles?","A. There can be up to 10,000 data categories. | B. Data category hierarchy can have up to 10 levels. | C. Articles can have up to 8 data categories.",B,"Among the given options, B is the correct answer as data category hierarchies do have a defined depth limit. Note: The official Salesforce limit is 5 levels (not 10) per Data Category Group, with up to 100 categories per group. Option A (10,000 categories) and C (8 categories per article; actual limit is higher) are also incorrect. When organizing articles, administrators must plan within these structural limits.",https://www.freecram.com/Salesforce-certification/Service-Cloud-Consultant-exam-questions.html?p=12
,58,A consultant has been hired to integrate a client's phone system with the Service Console.What is the consultant required to do during this integration?,A. Enable the Lightning Console. | B. Configure the CTI Adapter. | C. Add the utility bar to the app.,B,Configuring the CTI Adapter is the required step to integrate a client's phone system with the Service Console. The CTI adapter connects the telephony system to Salesforce via the Open CTI framework.,https://www.freecram.com/Salesforce-certification/Service-Cloud-Consultant-exam-questions.html?p=12
,59,Universal Containers (UC) hired agents in an expansion of the contact center. Getting agents up to speed and fully productive is a priority. UC implemented a standardized agent-customer dialog to assist agents.Which feature should a consultant integrate into the Service Console?,A. In-App Guidance | B. Einstein Next Best Action | C. Actions & Recommendations,B,"Einstein Next Best Action provides AI-driven recommendations based on the current case context, surfacing the best next steps from a predefined set of actions. This standardizes the agent-customer dialog while adapting to each situation.",https://www.freecram.com/Salesforce-certification/Service-Cloud-Consultant-exam-questions.html?p=12
,60,"Universal Containers wants to reduce the amount of time support agents spend creating cases. Case creation must scale up to 5,000 new cases per day and allow file attachments under 10 MB by the customer.Which feature should the consultant suggest?",A. Web-to-Case | B. On-Demand Email-to-Case | C. Email-to-Case,A,"Web-to-Case supports up to 5,000 cases per day and enables customer self-service case creation via a web form, which is the requirement here. Email-to-Case and On-Demand Email-to-Case are email-based channels, not customer-facing web forms. Among these options, Web-to-Case is the correct choice for a scalable self-service case submission channel.",https://www.freecram.com/Salesforce-certification/Service-Cloud-Consultant-exam-questions.html?p=12
,61,Universal Containers is using WhatsApp to provide support to customers in Service Console.Agents would like to preview PDFs sent by customers from the chat window.What should a consultant recommend?,A. Ask the customer to send the PDF via email. | B. Use File Preview in the chat. | C. Download the PDFs from the chat.,B,"File Preview in Salesforce Messaging allows agents to preview PDFs and other file types sent by customers directly within the chat window, without needing to download or open external applications.",https://www.freecram.com/Salesforce-certification/Service-Cloud-Consultant-exam-questions.html?p=13
,62,Cloud Kicks (CK) provides customized support based on product line and plans to expand from voice-only support. Support agents are certified on one or more specific product lines. CK would like to provide support through multiple channels. CK wants to ensure a consistent customer experience.Which solution should the consultant recommend to meet the requirements?,A. Omni Channel with Queue-Based Routing | B. Omni-Channel with Capacity-Based Routing | C. Omni-Channel with Einstein Case Routing,C,"Omni-Channel with Einstein Case Routing uses AI to intelligently route cases based on case content and agent skills, ensuring consistent customer experience across multiple channels for specialized agents.",https://www.freecram.com/Salesforce-certification/Service-Cloud-Consultant-exam-questions.html?p=13
,63,"Universal Containers is training a new set of service agents. Part of the training includes handling messaging from customers.However, it is important that contact center managers monitor the messaging sessions to ensure the service agents' responses are professional and accurate and that the managers are able to assist when needed.Which Lightning Console feature should a consultant configure to support this need?",A. Chat Supervisor tab and Whisper Messages | B. Incident Management tab and Whisper Messages | C. Omni-Channel Supervisor and Whisper Messages,C,"Omni-Channel Supervisor combined with Whisper Messages allows contact center managers to monitor active messaging sessions and send private messages to agents without the customer seeing them, enabling real-time coaching.",https://www.freecram.com/Salesforce-certification/Service-Cloud-Consultant-exam-questions.html?p=13
,64,The cost of providing contact center support has steadily increased. Universal Containers wants to take cost-saving measures.What should the consultant recommend?,A. Configure a self-service Knowledge Base. | B. Configure Skills-Based Routing for service channels. | C. Create auto-response templates for Case emails.,A,"Configuring a self-service Knowledge Base allows customers to find answers independently, reducing incoming contact volume and therefore reducing the cost of providing support without requiring additional agents.",https://www.freecram.com/Salesforce-certification/Service-Cloud-Consultant-exam-questions.html?p=13
,65,"The Universal Containers (UC) customer support organization has implemented Knowledge-Centered Support (KCS) in its call center. However, the call center management thinks that support reps should contribute new Knowledge articles more often.What should UC do to address this situation?",A. Measure and reward support reps based on the number of new articles approved for publication. | B. Measure and reward support reps based on the number of new articles submitted for approval. | C. Require support reps to check a box on the case when submitting a new suggested article.,B,"When the problem is that agents don't contribute articles OFTEN ENOUGH, measuring and rewarding articles submitted for approval directly incentivizes submission frequency. This lowers the barrier for contribution by rewarding the act of submitting rather than waiting for full approval, driving more frequent knowledge capture as intended by KCS methodology.",https://www.freecram.com/Salesforce-certification/Service-Cloud-Consultant-exam-questions.html?p=13
,66,Universal Containers (UC) has regional contact centers around the world. UC has implemented Service Cloud with the organization wide default for Cases set to Private. The UC role hierarchy is set up by region. Support managers want to see support metrics for their region by default. UC needs a scalable solution.Which strategy should a consultant recommend?,A. Create a dashboard using Reporting Snapshots. | B. Create a dashboard for each support manager. | C. Create a Dynamic Dashboard.,C,"Dynamic Dashboards in Salesforce run reports using the viewing user's data access, allowing each support manager to see metrics filtered to their region automatically. This is scalable without creating individual dashboards per manager.",https://www.freecram.com/Salesforce-certification/Service-Cloud-Consultant-exam-questions.html?p=14
