duplicate,#,question,choices,answer,explanation,source
,135,"Ursa Major Solar (UMS) provides customers with remote monitoring of solar panels. When there are issues with the service, such as a power outage, UMS needs to provide service agents, operations teams, and customers with full visibility into the issue.What is the recommended feature to meet the requirements?",A. Incident Management | B. Workforce Engagement | C. Field Service Management,A,"Incident Management is designed for widespread service disruptions that affect multiple customers. It provides communication templates, status tracking, and visibility tools for service agents, operations teams, and customers during outages.",https://www.freecram.com/Salesforce-certification/Service-Cloud-Consultant-exam-questions.html?p=27
,136,"Cloud Kicks (CK) has multiple product lines. CK is preparing to launch a public knowledge base for customers that will have 2,500 articles. The company wants an easy way for users to find relevant articles based on its product.What is the recommended method to meet the requirement?",A. Topics for objects | B. Data Category groups | C. Screen Flow,B,"Data Category groups in Knowledge allow articles to be organized by product line, making it easy for users to browse and find relevant articles by selecting their product category from a hierarchical structure.",https://www.freecram.com/Salesforce-certification/Service-Cloud-Consultant-exam-questions.html?p=28
,137,Support agents at Universal Containers are entering customer contact information in multiple ways.Management is concerned about the high likelihood of duplicate customer contact information being entered.What should the consultant recommend to prevent duplicate records from being created?,"A. Configure and activate Duplicate Management. | B. Grant ""View All Data"" and instruct them to search. | C. Implement Apex triggers for Contact.",A,"Duplicate Management (Duplicate Rules and Matching Rules) in Salesforce automatically detects and prevents duplicate records from being created based on configurable matching criteria, alerting users or blocking saves when duplicates are found.",https://www.freecram.com/Salesforce-certification/Service-Cloud-Consultant-exam-questions.html?p=28
,138,"Cloud Kicks (CK) wants to adopt artificial intelligence (AI) for improving case closure key performance indicators (KPIs) and product support planning within its Service organization. CK has at least 1,000 closed cases from which it can predict accurate values for fields that are empty. CK has yet to implement any Einstein AI products.",A. Review and address Case data issues and set up Einstein Article Recommendations. | B. Confirm there are enough closed cases and turn on Einstein Service AI Grounding with Cases. | C. Review and address Case data issues and set up Einstein Classification Apps.,C,"Einstein Classification Apps (Case Classification) use machine learning trained on closed case data to predict field values for new cases, improving case routing accuracy. With 1,000+ closed cases, CK has sufficient data to start. Data quality review is the first step.",https://www.freecram.com/Salesforce-certification/Service-Cloud-Consultant-exam-questions.html?p=28
,139,"To help service agents more accurately respond to a new case, Universal Containers wants a list of relevant Knowledge articles displayed on the Case record page.How should a consultant configure this requirement?",A. Add the Knowledge tab to the Service Console. | B. Add the Knowledge component to the Case record page. | C. Add the Knowledge related list to the Case record page.,B,"The Knowledge component on the Case Lightning record page displays AI-recommended articles based on case details and allows agents to view, attach, and share articles without navigating away from the case.",https://www.freecram.com/Salesforce-certification/Service-Cloud-Consultant-exam-questions.html?p=28
,140,"Universal Containers wants to implement several new Agentforce for Service capabilities. A Service Cloud Consultant must review the following business requirements to identify which one can be fulfilled by using a standard topic, rather than requiring a custom topic and actions.Which use case could an out-of-the-box AI agent address with no changes to topics?",A. Guiding a customer through the process of filing a warranty claim for a damaged shipping container and scheduling an on-site inspection. | B. Enabling a customer to check real-time stock levels for a specific container model across multiple distribution centers. | C. Answering a question about insurance policy and enabling the customer to open a new support ticket if they have a new issue.,C,"Answering questions about insurance policies and opening support tickets are standard customer service tasks that align with out-of-the-box Agentforce Service Agent topics ('General Service' and 'Case Management'), requiring no custom topic or action configuration.",https://www.freecram.com/Salesforce-certification/Service-Cloud-Consultant-exam-questions.html?p=28
,141,What is a consideration when adding a report chart to a Page Layout or a Lightning Record Page?,A. The report must be used on a Dashboard. | B. The report must have a standard Report Type. | C. The report must contain a chart.,C,A report must contain a chart before it can be added to a Page Layout or Lightning Record Page as a report chart component. The chart configuration in the report is what gets displayed on the page.,https://www.freecram.com/Salesforce-certification/Service-Cloud-Consultant-exam-questions.html?p=29
,142,"Universal Containers (UC) is coaching new service agents to improve their productivity and service quality.The agents must understand how to intake a case, mark the required fields for product issues, how to wrap up a case, and how to escalate a case.Which solution should the consultant advise that service supervisors use to meet these requirements?",A. Create an Omni-Flow for routing. Use a Screen Pop that serves a flow and the interaction record for the service agent. Report on the Average Handle Time and CSAT. | B. Place a flow in a Flow component on the case record. Add a custom field to the flow for tracking progress. Create a custom report type for providing the metric. | C. Set up steps with flows in an Actions & Recommendations deployment. Add the component to the service agent record page. Use Action History to spot check adherence.,C,"Actions & Recommendations with flow-based steps provides structured guidance for agents through case intake, field completion, wrap-up, and escalation. Action History tracks adherence, meeting the supervisor's coaching and compliance requirements.",https://www.freecram.com/Salesforce-certification/Service-Cloud-Consultant-exam-questions.html?p=29
,143,Cloud Kicks (CK) uses Lightning Experience and Lightning Knowledge in its service center. CK wants an easy way for service agents to create new articles when closing a case. The new article should include appropriate details from the case to make it useful for others.What is the recommended method to meet the requirements?,A. Develop a globally-shared macro to create a new article. | B. Use a trigger to automatically create a new article. | C. Create a Quick Action to map case fields to a new article,C,"A Quick Action on the Case object can be configured to create a new Knowledge article and automatically map case fields (subject, description, solution) to article fields, making it easy for agents to create articles during case closure.",https://www.freecram.com/Salesforce-certification/Service-Cloud-Consultant-exam-questions.html?p=29
,144,Universal Containers has a well-defined support process for cases which includes the following statuses:* New* Assigned* In Progress* Waiting On Customer* ClosedThe support manager has noticed an increase in the average age of a case and wants to understand how long a case is in each status.Which report type should the consultant consider when collecting data for the support manager?,A. Case Lifecycle | B. Cases with Milestones | C. Case History,C,"The Case History report type tracks field value changes over time, allowing analysis of how long a case spent in each status. By filtering on the 'Status' field history, managers can see time spent in New, Assigned, In Progress, etc.",https://www.freecram.com/Salesforce-certification/Service-Cloud-Consultant-exam-questions.html?p=29
,145,"Cloud Kicks (CK) wants to explore having a full Incident Management, Swarming, and Change Management process to provide a foundation for its auditing and governance needs. CK also wants interactive recommendations for every department during this process.Besides implementing Incident Management and Service Cloud for Slack, what should a consultant recommend for the full solution?",A. Implement flow orchestration with Work Guides | B. Implement a third-party app from AppExchange. | C. Implement Guidance for Success and Knowledge articles.,A,"Flow Orchestration with Work Guides provides interactive, step-by-step recommendations for each department during Incident Management, Swarming, and Change Management processes, adding the interactive guidance layer to complete the full solution.",https://www.freecram.com/Salesforce-certification/Service-Cloud-Consultant-exam-questions.html?p=29
,146,"Service agents have reported that the Lightning Service Console is too crowded which makes it difficult to find the information they need. After reviewing the agents' console use, a consultant has determined that all configured features are required.Given this scenario, which solution should a consultant suggest to improve the efficiency for console users?",A. Train on keyboard shortcuts. | B. Prepare macros. | C. Create multiple console layouts.,C,"Creating multiple console layouts (Lightning app configurations) for different agent roles allows each group to see only the components relevant to their work, reducing console clutter without removing required features.",https://www.freecram.com/Salesforce-certification/Service-Cloud-Consultant-exam-questions.html?p=30
,147,"Cloud Kicks provides telephone support to customers. When creating a case, service agents frequently enter shipping postal codes from various countries around the world.What is the recommended method to ensure accurate data is entered?",A. Set up duplicate rule with matching rules. | B. Configure validation rule with VLOOKUP. | C. Create a cross-object formula.,B,"A validation rule with VLOOKUP can verify that entered postal codes exist in a custom reference object containing valid postal codes by country, ensuring accurate international postal code data entry by service agents.",https://www.freecram.com/Salesforce-certification/Service-Cloud-Consultant-exam-questions.html?p=30
,148,"Cloud Kicks has hired a Service Cloud Consultant to build out its reports. The consultant is having trouble locating the ""Accounts with Entitlements with Contacts"" and ""Service Contracts with Contract Line Items"" custom report types.What should the consultant do to troubleshoot?",A. Verify that Salesforce Knowledge is enabled. | B. Verify that entitlement management is enabled. | C. Verify that Historical Trend Reporting is enabled.,B,The 'Accounts with Entitlements with Contacts' and 'Service Contracts with Contract Line Items' report types are only available when entitlement management is enabled in Salesforce Setup. Verifying this setting resolves the missing report types.,https://www.freecram.com/Salesforce-certification/Service-Cloud-Consultant-exam-questions.html?p=30
,149,"Universal Containers provides customer support for both new products and routine maintenance of existing products. The cases for both types have many stages and fields in common; however, the maintenance cases have additional stages and fields that need to be captured. Which feature should a consultant recommend to accomplish this objective?",A. Approval Processes | B. Support Types | C. Support Processes,C,"Support Processes in Salesforce allow different picklist values (case statuses) for different case types. This enables maintenance cases to have additional stages (e.g., 'Parts Ordered') beyond the standard stages shared with new product cases.",https://www.freecram.com/Salesforce-certification/Service-Cloud-Consultant-exam-questions.html?p=30
,150,"Universal Containers requires that users have the ability to view specific cases, as determined by the Product Type field on the case. When a case is created or closed, an email should be sent only to users who have access to the case.Which feature should a consultant recommend to meet these requirements?",A. Case teams | B. Case swarms | C. Account teams,A,"Case Teams allow specific users to be granted access to individual cases with defined role-based access levels. When users are added to a case team, they receive email notifications. This addresses both access control by Product Type and email notification requirements.",https://www.freecram.com/Salesforce-certification/Service-Cloud-Consultant-exam-questions.html?p=30
,151,What is a common deflection technique to reduce the number of interactions for a contact center?,A. Suggest articles for an Email-to-Case question. | B. Recommend articles prior to a Chat session. | C. Recommend articles during a call from a support agent.,B,"Recommending Knowledge articles before a chat session starts (via pre-chat suggestions or self-service portal) helps customers find answers without initiating a live chat, reducing agent interactions and serving as an effective deflection technique.",https://www.freecram.com/Salesforce-certification/Service-Cloud-Consultant-exam-questions.html?p=31
,152,"Universal Containers has created permission sets granting access to objects and fields in one of its sandboxes.Following best practices, how should a consultant deploy these permission sets to production?",A. Use a change set. | B. Re-create them manually. | C. Use Salesforce Workbench.,A,"Change Sets are the recommended deployment tool for moving configuration changes (like permission sets) between Salesforce environments following best practices. They provide a governed, trackable deployment process.",https://www.freecram.com/Salesforce-certification/Service-Cloud-Consultant-exam-questions.html?p=31
,153,A contact center manager wants to measure improvements to capacity planning operations after the implementation of a new workforce management system.Which metric should a consultant use to assess the success of the new workforce management system?,A. Number of closed cases | B. Agent utilization | C. Deflection rate,B,Agent utilization (percentage of time agents spend actively handling work) is the primary metric for assessing workforce management effectiveness. Higher utilization indicates better capacity planning and scheduling efficiency.,https://www.freecram.com/Salesforce-certification/Service-Cloud-Consultant-exam-questions.html?p=31
,154,Universal Containers is getting ready to start User Acceptance Testing (UAT) for its customer service transformation project. The consultant has been asked where the testing should occur. The business users and stakeholders need an environment that can support 60 days of UAT and includes representative data from production.Which environment type should the consultant recommend?,A. Partial Copy Sandbox | B. Full copy sandbox | C. Developer Pro Sandbox,B,"A Full Copy Sandbox mirrors production data and configuration exactly, supports 60-day refresh cycles, and contains representative production data. It's the appropriate environment for UAT requiring production-representative data and full testing duration.",https://www.freecram.com/Salesforce-certification/Service-Cloud-Consultant-exam-questions.html?p=31
,155,A consultant has been asked to advise Cloud Kicks (CK) on how to manage 5 years of case data so it is available to customers upon request.Which feature will help CK users archive and access the case information from an External Object?,A. Salesforce Big Object | B. Salesforce connect | C. Salesforce Case History Object,B,Salesforce Connect with External Objects allows case data stored in an external system to be accessed within Salesforce through virtual objects. This provides customers access to archived case data without migrating it to Salesforce.,https://www.freecram.com/Salesforce-certification/Service-Cloud-Consultant-exam-questions.html?p=31
,156,Which advantage does Salesforce provide with the OpenCTI framework?,"A. Developers can Integrate with any telephony platform available with minimal need for customization. | B. Agents can use telephony on a wide range of browsers and operating systems while only developing once. | C. Agents can run their softphone at the operating system level, embedded in the task bar or system tray.",B,"Open CTI allows developers to build CTI integrations that work across any browser and operating system using web technologies, so the integration is written once and works everywhere agents work, regardless of platform.",https://www.freecram.com/Salesforce-certification/Service-Cloud-Consultant-exam-questions.html?p=32
,157,"Cloud Kicks (CK) uses Service Cloud and Slack. For difficult cases, service agents want to create a swarm in Slack to pull in experts from multiple CK departments.What should the consultant recommend to an agent who wants to launch a Slack Swarm?",A. Escalation rules | B. Apex trigger | C. Quick Action,C,"A Quick Action on the Case object can trigger Slack Swarming, allowing agents to launch a Slack swarm channel from the case record with a single click. This is the recommended low-code approach for initiating swarms.",https://www.freecram.com/Salesforce-certification/Service-Cloud-Consultant-exam-questions.html?p=32
,158,A Service Cloud Consultant has deployed a new Agentforce Service Agent. The AI agent is not receiving messages.Which steps did the consultant most likely miss in the configuration process?,A. Editing the Omni-Channel Flow to route the conversation to the new AI agent. | B. Configuring the standard Escalation Topic and actions in Agent Builder. | C. Assigning the new AI agent in Embedded Messaging chat component in Experience Cloud site.,C,"For an Agentforce Service Agent to receive messages, it must be properly assigned/connected in the Embedded Messaging chat component configuration. Without assigning the AI agent to the messaging channel, messages cannot be routed to it.",https://www.freecram.com/Salesforce-certification/Service-Cloud-Consultant-exam-questions.html?p=32
,159,Cloud Kicks uses the Service Console and work items to route cases to available service reps. The service reps need a way to see work they have accepted and incoming items.Which feature should the Service Cloud Consultant recommend?,A. Personalized navigation menu | B. Actions & Recommendations component | C. Omni-Channel Utility widget,C,"The Omni-Channel Utility widget in the Service Console shows agents their current work assignments (accepted items) and incoming work items, providing a unified view of their workload without navigating away from the console.",https://www.freecram.com/Salesforce-certification/Service-Cloud-Consultant-exam-questions.html?p=32
,160,A consultant is advising Cloud Kicks on developing call center metrics to measure service rep productivity based on a combination of quality and practical metrics.Which key performance indicator (KPI) usually points to high customer satisfaction?,A. Knowledge article creation rate | B. First Contact Resolution | C. Self-help case deflection,B,"First Contact Resolution (FCR) is the KPI most directly correlated with high customer satisfaction. When issues are resolved in a single interaction, customers are more satisfied and more likely to remain loyal.",https://www.freecram.com/Salesforce-certification/Service-Cloud-Consultant-exam-questions.html?p=32
,161,The contact center at Universal Containers wants to reduce case volume and resolution time within Service Cloud.Which solution should a Service Cloud Consultant recommend?,A. Use the Article Auto-Response flow. | B. Embed the Agentforce Service Agent in the Service Console. | C. Implement a Knowledge base for customers and internal users.,C,Implementing a Knowledge base for customers and internal users reduces case volume through self-service deflection and improves resolution time by giving agents instant access to documented solutions for common issues.,https://www.freecram.com/Salesforce-certification/Service-Cloud-Consultant-exam-questions.html?p=33
,162,Universal Containers provides customers with different service levels based on their services agreement. The VP of customer service wants to use Service Cloud to track when cases have yet to reach certain stages and ensure that senior management is alerted accordingly.Which feature should a consultant recommend to address this requirement?,A. Reports and Dashboards | B. Entitlements and Milestones | C. Service Contracts,B,"Entitlements and Milestones allow tracking of case stages against SLA targets. When a case fails to reach a milestone within the required time, alerts and escalations can be triggered automatically to notify senior management.",https://www.freecram.com/Salesforce-certification/Service-Cloud-Consultant-exam-questions.html?p=33
,163,Which feature should a consultant recommend to prompt a Tier 2 service representative to take over case processing from Tier 1 and know how far Tier 1 had progressed in troubleshooting?,A. Path for Cases | B. Escalation Rules | C. Einstein Next Best Action,A,"Path for Cases displays the current stage in the case lifecycle with key fields highlighted for each stage. When Tier 1 escalates to Tier 2, Path shows exactly which troubleshooting stage was reached, enabling Tier 2 to pick up where Tier 1 left off.",https://www.freecram.com/Salesforce-certification/Service-Cloud-Consultant-exam-questions.html?p=33
,164,Universal Containers (UC) is implementing Service Cloud. UC needs to reduce total case volume and the average amount of time spent by agents on cases.Which solution meets these requirements?,"A. Use escalation rules to move cases into the correct status. Create reports to monitor service-level agreement (SLA) adherence. | B. Enable agent chat functionality for customers. Disable the ability to log a case from the Experience Cloud site. | C. Publish Knowledge articles to the Experience Cloud site, Enable the attachment of articles upon case closure.",C,Publishing Knowledge articles to Experience Cloud for customer self-service reduces incoming case volume. Attaching articles to cases upon closure builds the knowledge base and reduces future resolution time. Both measures address the two requirements.,https://www.freecram.com/Salesforce-certification/Service-Cloud-Consultant-exam-questions.html?p=33
,165,"Cloud Kicks (CK) has created hundreds of Knowledge articles about its products. The articles have been attached to closed cases. A new product release will require changes to dozens of articles.After revising the articles, CK wants to ensure that a prior article version stays associated with the closed cases.What is the recommended method to meet the requirements?","A. Add ""updated"" to the name of the new article. | B. Use Smart Link to Article to select the prior version. | C. Select the Flag as new version checkbox when publishing.",C,Selecting the 'Flag as new version' checkbox when publishing a Knowledge article update creates a new version while keeping the prior version linked to closed cases. This ensures historical case-article associations remain accurate.,https://www.freecram.com/Salesforce-certification/Service-Cloud-Consultant-exam-questions.html?p=33
,166,"Cloud Kicks (CK) started out as a small shoe company. Now, CK is growing and needs to meet changing customer expectations while also uplifting agent skill sets and organizational success.In which order would a consultant work through a high-level discussion and planning session with CK?","A. Gather organizational vision, map processes, plan metrics, and plan for user feedback. | B. Gather organizational vision, map processes, plan for user feedback, and define metrics. | C. Gather organizational vision, match appropriate metrics, plan for user feedback, and map processes.",A,"The recommended consulting order is: Gather organizational vision (understand strategic goals), map current/future processes, plan metrics (define KPIs), then plan for user feedback (adoption and change management). This follows a logical top-down planning flow.",https://www.freecram.com/Salesforce-certification/Service-Cloud-Consultant-exam-questions.html?p=34
,167,"Universal Containers (UC) frequently receives complex customer issues that require retrieving information from internal knowledge articles not tagged with individual fields. UC needs a service that can process this data and provide accurate, grounded responses.What should the Service Cloud Consultant recommend?",A. Agentforce for Service and Agentforce Data Library. | B. Einstein Bots and Article Answers feature. | C. Apex layer that fetches data in real-time from multiple data sources.,A,"Agentforce for Service combined with Agentforce Data Library enables the AI agent to retrieve and process information from unstructured Knowledge articles without requiring individual field tagging, providing grounded, accurate responses to complex queries.",https://www.freecram.com/Salesforce-certification/Service-Cloud-Consultant-exam-questions.html?p=34
